Username,Content
DavidPrenticeJr,even decide make motorcycle medium coverage fatality would significant problem address every related incident make news
talkingevs,believe silver wheel cover made final production far ugliest thing swapped mine taking delivery parking lot
Resonator_Steve,agreed need cost similar third party
RockerKevin,meta quest getting update mashable
MUFC00091,hot bed racism sued multiple front racism started top filtered
DaAnsahonSports,historic diplomatic immunity vol day diplomat age founding age age day later debut l total
Teslafsdcar,oh gosh saturdayvibes
MattGriscom,others term manufacturing efficiency charging network ai software based design entirely intended integrated frequent software update
Jesse369Tesla,simple man yeah
teslaownersSV,literally cigar chilling good guy started whole space
FreedomAlways,amazing balance starlink x spacex child yet u pulling fire alarm house representative people choose future bold innovative huey elon
TeslaSynopsis,another pic elon thumb
AwokeKnowing,dumb thing say seriously think government shouls force ev matter win government mandate
TeslaTakesOver,good job
Chintu04782449,revolutionizing speed style roadster poised redefine electric performance teslaroadster innovationunleashed
tonyschorr,helped solve crime today got hit run video black suv chased got plate number
FlaTesla,drive model rachael feel younger woman
MrTeslaX,hahaha mistake admitted
Businessbaec,would
strategistjas,gas
StinkBot2,production spread around world germany usa china mexico coming next
FloralesReboot,passion lack except maybe tinkering shooting weapon christmas stopping covid vaccination
PeerGroupInvest,delivering car fsd installed update required via teslarati
MrTeslaX,gaming setup need improvement
teslaemo,sad leave
LeeGoffIII,serious fyi password access everything
TeslaSynopsis,pretty fun game solo self found
LucWaterlot,ready modely
TeslaModelDoge,going bed tonight greg
TheEzkan,rocket good well engineer solar piwer reaching scam apple car aka overpriced b ai vission anyone dont see bringing meaningful ai satelites became severe issue space exploration waste
EnzymeX,prediction switch brand ev work supercharging
nicopico5,even opposed favor subsidizing forcing fantastic trump
BlazingHusky,miami fan still grieving stuck anger stage
ABehiel,love depreciated surprised mission jump reduce price price reduction norm tech might check write law probably buy another hopefully lower price
JoshuaThePilot,costco cause mine lol
TakTesla,ready launch beast key fact general public see double thrust saturn v biggest rocket ever production cost orbit reduced substantially starship imagine much share orbital launch appreciate tonnage send orbit beast
Prince_Tweet,people cognitive dissonance talking aiming
nochalbestiny,oh relax product
ShaunRy96660644,filmed scraped think called platen chrome rod die half ride upon giga texas machine require maintenance refurbishment nuralink robot giga press company run engineer accountant vital
Jesse369Tesla,foolin def leppard yeah
tesla_owner_,ban woman
HJDavies3,wow bought third june tonight get sale call saturday evening pushing get another good sale initiative dinner friend
bexcran,nope wanted stop burning gasoline every drove somewhere back option still wanted go road trip solar panel want burning coal utah use electricity
NonTwiterJohn,egregious hit piece date
Lootster,defective yet tesla would make dan
realizzypresley,live podcasts week tuesday return pst thursday afternoon tba live studio talking vega residency record sobriety
FlaTesla,agreed
JPUConn,slapping black cover silver wheel look terrible bc silver lip still show
DeNguyen73,unfortunately huge amount torque tesla need rotate tire often change entire set frequently still pushing add friendly reminder rotate tire every mile easy change extra wheel lift jack impact gun
jgmac1106,craft venture bug fund round airbnb reddit course peter thiel jd vance colt backed rumble rumble bought local patreon craft backed investor included patrick byrne tulsi gabbard nothing illegal flock folk
Sanya_Florida,someone tell battery need every year
OutofSpecDave,thinking hosting spec ev road cruise targeting saturday october meet ridgeway plaza stamford ct charge various cc car soc drive approx mile north ct fall foliage mountain lunch ride back compare note recap day course make video brand ev welcome would interested
TeslaPhx,follow recipe right
DarnellTheGeek,wall charger last checked pay wired breaker box also portable charger top kwh plug outlet plug outlet
teslaownersSV,hamster coin
werosolo,right
yilunzh,right gave huge boost given range extenders though aito core customer base skews older think overlap li auto
unhappyallthet1,stop scrounging elon get platform nothing constructive pleasant say go
TeslaRoshi,yo stop wasting holding cuz last launch hurt bird nest sure seem unbiased decision
FlowDiscs,mvp solid love control consistent flight
harrytiffanyiv,moron american made automobile currently electric vehicle built le maintenance gas engine car cost le per mile driving man homework first subject else done homework
RonDeSantis,president reverse biden mandate electric vehicle save american automobile able purchase best wrong washington elite state california tell kind buy
JPUConn,still pathetic wheel cover cover lip rim hubcap rim cybertruck aftermarket cover extend rim face entirely
PhatTesla,exclusive subscription needed game b money grab slap face nfl fan wait til exclusive playoff game hit peacock
TeslaSynopsis,elon playing diablo
OrkinJared,secret feature alert say sober watch happens next sneaky genius teslamagic eastereggchallenge
wallyb4you60288,electric car junk hybrid future
hypnoksa,year le market uaw destroy ford gm toyota chinese company union finishing industry destroying year
SenWarren,gm spent billion stock buyback alone invest worker stand worker fighting fair contract
JDKendall18,first charger installation book took twice long proud finding solution problem came learned lot make go faster decide future
JurgHolzle,elon dependent china afford oppose china factory would history spread chinese propaganda
TeslaModelDoge,looking win
PhoonFITS,people would rave cybertruck steel extraction future
ZacksJerryRig,let see titanium actually grade
ChrisFacciol,allowed vote age dead alive
hypnoksa,year le market uaw destroy ford gm toyota chinese company union finishing industry destroying year
AbeAllen,see plant mexico go fast without many hurdle okay
liorsela,think delivery number determine monday think usually release number open
TeslaSynopsis,omg best wish elon spacex let gooooooooo
lukefrisbee,increase wage greater index auto worker average worker close ice builder management work environment culture increase wage stock show strength
hershohm,neither make superior vehicle use case
RyanKarr44,mouthy exactamundo going back debacle wan start emoted prior start dead relative start need cease end kaput abyss keep lite
ABC,pres biden say statement stopgap funding bill passed congress good news american people saying house republican failed
wheelsee,even weirder fascination lying cc hyping
TeslaP1197794,loony stop spreading misinformation
TeslaNewswire,us recent model park assist talking us
TeslaTruckClub,stealth goth though
MatthewTBishop,company run going border impacting spacex
wheelsee,weird always owner taking weird long as road trip
polareclipse1,yet greenest company planet plan eliminate fossil fuel elon contrarian naive also dems demonized getting rich rich making electric car
TOWERYLS,technology fallen patriotism god kingdom would happen
fastlaneupdate,getting say able buy whatever want think destroying huh
wallyb4you60288,reality check electric car useless hybrid way move forward going bankrupt ford company push crap fine country size rhode island america want sit hour
FlaTesla,idk ask
TESLAGovFunded,go way read copy pasted russian propaganda hard pas pinned tweet
PatriotRevpaddy,think develop motor cruiser hover bike star war disney mandalorian problem would popular would able keep manufacture would also perfect vehicle quick surface travel would hover
TeslaRoshi,response hilariously ignorant knowledge rather shallow biased quote medium opinion actually understanding actual evidence
Thomas588938738,etharmy renowned company cryptocurrency bitcoinbutton innovation horizon bitcoin okx venture continues avalanche apecoin half doxcoin
ericwdolan,
TeslaNewswire,according internal document newly refreshed model still relies brings back ultrasonic sensor us longer includes radar indicates confidence vision ap park assist modely
xiaoteshushu,seems internal document indicates update still based includes ultrasonic radar radar removed
MartianWheels,thanks got work tomorrow close racing
partitioncharge,making supercharger stall single site located gardermoen norway vehicle cc look
tradeui,barron weekend stock pick dollar tree meta delivery estimate dltr fsr meta pm tsla
C_Rubicam,comparing retail chain gaming store bunch movie theater ridiculous
xChicagoDave,buy electric hope really good planning ahead lot extra waste three car saw waiting least minute charger open charging station full parked car people inside shopping eating
TeslaTruckClub,sorry unsee
TeslaTruckClub,notice front look lip
ajphelo,ccp ganging also cross hair psb case preventing owner recharging saying charging station national brand
prollyhighaf,currently telling uches blue kckdkdkxkmddk im screaming
TeslaKevin,never seen someone jealous started impacting whole life yikes
FlaTesla,great worked small job first disney make manager work every employee job every job
olliolliox,much rent dc per month afford apt nyc wardrobe public servant salary take
TeslaModelDoge,uranus
TomBurg33600765,nikola burgess agreed many many thing adamant point agreement energy abundant natural resource free free first got free figure get ahold
M4494929521825,even lose investment elon would worth supporting awesome advocate
nochalbestiny,hope follower read
unhappyallthet1,get platform scrounging sweaty old trout
NSgarv,fun person picking
sajch93,may solution san francisco break in cyber truck unbreakable window
TeslaRoshi,idea around year someone invents machine give credit back future think understand tech start easy path goal human trial
StormWatch12345,going call fastest model cheetah considering cheetah fastest land animal
astral_hAnZen,maybe think political party afd could get benefit investment ideolegies seems fit capitalism
msaristotle,meant mile think meant
niccruzpatane,black best
_KurtKnapp,model numb nut
brianlocal619,see employee strike
Jesse369Tesla,white horse rolling stone yeah
StevenFaludi,amazing much good people money need twitter spacex boring company anyway
JurgHolzle,aging model vw group many model offer vw europe change byd fair market subsidy china byd would crush usa
on_tesla,upgraded
TeslaKevin,
JasonTSLAguy,follow money
ReDHoTPiNK88,tell husband
nochalbestiny,oh boo hoo big pretending tough guy problem spending money gun firing weak film
AapKaAmitSri,guy launching india
rakeshprakash1,bengaluru electric caught fire near dalmia circle jpnagar area today casualty reason yet ascertained
NewAmerica2438,going rumor uncle tesla said key universe understanding kjv bible testament long daniel
TeslaFuzz,jury say otherwise
man_theta,day buy put mm gon talk shit day long something go wrong
TSLAFanMtl,advertising part strategy falsehood community advocate advertising suggesting advertising weekend flash sale goal ad campaign would build awareness brand equity among larger part market strategy would also reward probably bc never done impact would felt fast ultimate objective
TeslaLaborUnion,would want delay vote bill voted cause dumb ever done something really stupid embarrassing life
StellarBlazin,hopefully adapt charging network sooner
TeslaTakesOver,awesome gorgeous sight see
busasquatch,song emotion wish favorite song hand breakin free top
Tesla__Mania,surely make sense model slower model equivalent
DatHandsomeJerk,future
LucWaterlot,picture day gm people teslaworld great day testcars secbruges teslaeurope
alebusinesss,minimalist style offer
unhappyallthet1,get elons platform scrounging moaning hypocrite
VainHostile,called year ago advanced tech
Mikehomeseller,agree actually model great sound system sound great
bvTechie,got talk original roadster owner tonight early day majorly nerded took garage show everyone say definitely smaller think would made night
TeslaRoshi,heard xai likely first external customer equivalent aws ai mission creation gai human interest developing llm pretty
scarab_art,thanks throwing everyone actually care art bus narrow minded ignorant try maintaining relevance group owner creative thought climbed window
afjerry,said never going solve fsd autotaxi level using coding nuro net right nothing net concern still manual process extract video edge case train hoping human learns edge case needed
teslaownersSV,update faa approval
My_TeslaModelS,super cheap tractor country routinely treat parasite thought
scottr208,definitely buying
FlaTesla,seeing posiedon adventure enemy state great
A1Tesla,beyond reset animated short film via
lillijo13,happyness sunday synopsis
TeslaModelDoge,moon
JayMonobea,auto union matter let recognize number f combined value old soar reasonable solution ford gm shrink autounions changingtimes
raskal_cal,agreed live land owner say kinda annoying dislike quiet car
ashoknutheti,may increase price model next month
TeslaModelDoge,moon
Alice1314321,green suit cybertruck
JurgHolzle,met driver yesterday charging byd dolphin confirmed want thailand live bangkok trip mean day work time km byd dealer within km
TeslaTakesOver,
Price_Georgia,experience actually quite good see improvement monthly
pamrupert,sure must drive farther min candy store rich must go test drive find maybe pay someone research say something
PaulHPowell13,yeah first need pas wife test first second would definitely want feeling mean x price range far definitely need replace van wife want consider bit challenge
m25739365,shipping car fsd
MrTeslaX,ford killed sexy reason model
TeslaTim2,exactly want get department defense sold mexican drug cartel killed american border agent let slide
Jesse369Tesla,look back boston yeah
B_HiTech,silly biden recognize elon spacex elon related company unless attacking trump called elon national treasure comment silly political word either way reviving subsidy destroy competition
billgates46373,going stop recommending buying car everyone customer service awful reply twitter
ElectricIsraeli,think construction theater restaurant santa monica first many
TeslaPhonatic,home mile inland building water
FlaTesla,great bear scene
ElectricT3ch,ca believe fast model performance depreciated month cost best offer get depreciationdrama
FlaTesla,good movie
MERICATHEDREAM,need
EnzymeX,would add ev quite good thing supercharger make tesla practical need home charging rest ev serious disadvantage road tripping many year
teslaliving,kwh generated last week solar mwh generated last day gosolar bot
mcarrieri,better sell
TeslaTruckClub,caught meteor tonight also guess camera must dead pixel dot showed display raw video clip
TechnomediaC,greenerproblem compounded fact manufacturing automated man cut everything wage decreased uneven profit distribution mean le green grass man mowing rocket science
alebusinesss,personally feel hurting saying people able buy whatever
4Kpodcast,think could useful lot owner
ohjimme,cybertruck please built terrain map thanks roaders camper
MarkEakin,hiding overbite
unhappyallthet1,elon nothing constructive say get platform sound jilted
EvasTeslaSPlaid,worry always survive
BillyM2k,give anxiety
Seattle_RT,amen
EndWokeness,black immigrant put annoying white liberal place blm protest
VPoopskin,bought
TeslaNewswire,bring back scoop
Ali_TeslaMY,pursuit happiness
hswcyd,love elon reason car spacex
Ancient_Geo,best part part improving upon nikola original quite feat already taken data good puzzle seeing unconventional counterintuitive creativity work
michbetancourt1,filter elon played content every often want usually content see tweak done said x
dateTampaAngel,microsoft hint hint wink wink data center elonmusk really want billgates molten salt nuclear reactor planned
TESLAGovFunded,actually probably dropped really
ray4teslla_,ev fire especially fire posted x giving u impression ice fire even exist fact matter ice vehicle time likely catch fire ev ice fire incident
TeslaLaborUnion,think saying stupid saying probably used going obviously trying obstruct vote since vote even building
AliThaGreat,stupid post reputation span decade highest brand recognition amongst millennial gen z consumer shit coming mouth sarcasm everyone know tesla made usa chill
bestjoekim,worried ct marketing true ct revolutionary people learn general may buy model cybertruck america adoption ev fast enough compared europe china austin factory really ramp refreshed along cybertruck think advertising needed keep going full blast production
RickHam07779727,move apple brainwashed well trillion market hold worth million sooner later
PETER_TRAINER,great answer
TeslaXplored,go
bennyjohnson,capitol police release security footage insurrectionist democrat jamaal bowman pulling fire alarm effort delay house vote keep government open
TeslaRoshi,specific incident murky x need abide law speech share desperate opinion msm x destroying x used leftist propaganda engine twitter file ring bell clown
TeslaHaxz,dude serious clown energy
sliafrettiwt,every human intervenes fsd unsafe driver never intervened manr million intervention make correct bank transaction regularly would stay bank regardless small print
TeslaNewswire,mean ultrasonic sensor
Westdale5Julia,largest ev charging station world powered generator harris ranch supercharger station impressive beast charging bay facility coalinga california largest charging station world
KaneChen10,creating thing never created gm refreshing car
RockerKevin,trial fatal autopilot incident begin california insideevs
RockerKevin,semi log mile single day independent test insideevs
RockerKevin,model performance facelift may get motor vin suggests insideevs
E_Vehicles_Aura,offer immediate fsd access newly delivered car
PPP_TheOcho8,keep fan get em
EvasTeslaSPlaid,biden
wiseconnector,tell lie
Comed_Ai_n,pay full coverage probably list accident speeding ticket record
Tillsbury1,cheap need space want ultimate speed lux want buy wall charger start enjoying life inside tip get ready want change second almost immediately
alebusinesss,drive better miami driver
strengthPlan,want obstacle video got obstacle add list upcoming tsla
UrakawaMark,buy based union non union fact gm ford pathetic ev must buy ev hollow conversation expect aoc
unusual_whales,aoc said want trade tsla ev
TeslaBrampton,omg glad safe reading later nut went numb update
lovelykola18,fucking zooooooming
tommyd827,wonderful wednesday
EvasTeslaSPlaid,captured amazing sunset tonight backyard
Hobbstyle53,lol
antfunee,easy cheap hack buy can
ExtropianEric,happen car annoying matter look
DHo1969,production delivery coming monday premarket consensus might come
TeslaXplored,hey great idea increase take rate fsd give try
WholeMarsBlog,allow user subscribe fsd directly order page say nobody select say month cancel people subscribe even buy also help people see eap lower subscription
O2L,slight collision costco parking lot confirm prefer cybertruck awesome branch scrape across body mudding
sii_pan,welcome upgraded model made human china
Boobalaa1954,dumbest feature witnessed get wreck wheel lock worse two tesla wreck car immobilized blocking minor fender bender
haon_papa,
tres444,post something man
russvanderpool,likely end september last day chance transfer fsd old
AlexGer83527737,much public support man current
Tesla_Aus,alll sniffing like sniff little girl illegal immigrant unlimited supply little girl sniffing joe sniff little girl without calling hunter biden
Otaku_Fish,incredible thing happening coil shrimp tiktok
AHavrilla,tesla american made vehicle index car com named four electric vehicle model automobile
TESLAGovFunded,wrong democratic republic governed constitution
alebusinesss,think america look compact reason
EddieT0817,buy stock
ctlottery,hurry grab chance tonight incredible million powerball jackpot get ticket
stackup1301,invest
FredrickUphoff,electrocuting death elephant vain attempt sell dc ac pretty move right course people remember edison
TeslaBrampton,paging translate
PhantomXMusic69,benjamin franklin tolkien
OnDaBus6am,nice start
TeslaRoshi,super reliable still unreliable patchy coverage existing le range getting better fiber optic mean wired internet plus carrier control content anymore
BrianSchmelzlen,since obvious bias actual way prove right would people use fsd relying biased report lead truth
TeslaModelDoge,saw real queen ny protest
TeslaModel420,salam alaikum bro worth responding people lol
XxtremeBD,black electrical tape edge pop black wheel cover back blended black solved
Tesla4all42069,blame uranus
Dino95177184,right end result people buy best money
TeslaFanDan,replying twist hong kong bay dim sum cart roll dragon play skyscraper rise harbor sight posting city east meet light
RonR39263155,
BrianBaum44,aoc trade tell people afterward lol loser
TeslaModelDoge,need watch show beef
John89699065827,etharmy renowned company cryptocurrency binance jp morgan attracted number user pancakeswap mev landscape start see doxcoin
draa11387424,robot actually pay real people worker pretty well need many
ajtourville,winning cnbc claim pay worker far lower hourly wage compared legacy automaker gm ford stellantis foreign
beyerch,truth tsla tslaq tsla tslaq
Tesla4all42069,dying win glad
Carinaclar33377,call animalistic
j32pmxr,base model sr call anymore phenomenal money literally insane value
imEthanDeVries,model really fantastic product model also entry level product moment amount value get base product something believe appreciated drove loaner model around past day love model wow sad give back
Hobbstyle53,thanks
hswcyd,let people trade cybertruck money willing pay get cybertruck deliver month side benefit trade question
unhappyallthet1,wonder many kid vulnerable people slave away mine material make solar panel battery could virtue signal claim great person
ExoticsHonolulu,car coffee today delivery team delivering customer check video car coffee hawaii instagram carsandcoffee
TeslaModelDoge,would go straight moon
jchybow,really seem outsources tweet teen employ fsd video
TeslaTakesOver,keep dreaming
TeslaLisa,cool
TKremenetskay,totally make noise
TeslaPhx,going
EcHoToNe,beautiful light show create moment lifetime
BillyJamesLouie,performance low profile tire easily damage wheel pot hole
TeslaLisa,x soft least month transferring else would buy
Ellie_Brown6,lol much
TeslaFanDan,week impeachment wind blow diner show border dispute take stage supercharger canadian page court trump plea stow uk model fast tow week clash flash woah
SeanForFive,williamson co parking ped bridge elevator got cheaper downtown garage
phanie_chelle,bravo appreciate much
SeanLHughes,confidently say robotaxi knowing last place may never catch could may never
Hobbstyle53,good job
ChrisFacciol,trump would got life
YumikoYagami16,investment spacex
ebsigns,wef world overload western collapse agenda
i8055anil,blast
Hobbstyle53,already
wimoracle,first model love car rivian software update well ota fact consistent sure far along work equally well least company
JermTesla,yo step big kid playground
MissJilianne,people electric want drive fourteen minute candy store electric donald j trump anaheim california
xiaoteshushu,seems internal document indicates update still based includes ultrasonic radar radar removed
rando_tweeting,every guy find gf worse person previous
EvasTeslaSPlaid,better little house flled love big house filled stuff
TeslaLisa,changed give
jusanothertesla,wow pretty cool update would love ambient lighting
SawyerMerritt,breaking launched updated model giga shanghai price feature ambient lighting textile dashboard material wood black gemini wheel previously silver change texas model
Lizbeth27Kelly,good cautious
TeslaModelDoge,fly sure
TeslaTakesOver,painting starship next
Saucestache,pay get rid haha compare
goldber_g,let honest buy never
TeslaXplored,wan skip election lol
PaulHook_em,
PowerTripReport,planning could holy shit wall wall powered desert tricky bugger
TeslaRoshi,oh climate sustainable understand difference need people spell seem think
waqasi,gon big party buy
cindyfun999,strange dangerous driving buying
Hobbstyle53,
DigitalColmer,autonomous electric motorbike could slash road fatality injury dramatically currently missed opportunity
JermTesla,paid hr last week last day
Hobbstyle53,good point
TDeverex99044,back lot talk btw drove car plenty prefer comfortability hyundai ionic ev iconic hyundai
brtong_,owns distribution counting sale customer service rep
who9816,today hold kaspa ka get reach getting aim provide discount need find way investment important prove somethings real world wait
who9816,bought ka kaspa coin future
TysonCyberTruck,nothing going stop choice biden trump definitely trump
mizera_steve,model auto pilot foggy degree f driver passing two car auto pilot brake moved right coming still lane went thanks elon saved life
Ali_TeslaMY,job elon worked worked video game company called rocket science vancouver worked boiler room crawling tunnel hazmat suit would shovel esteeming sand mulch boiler clean elon also worked lumberjack wheat farmer going college
jchybow,prove unsafe
TeslaTomMY1,bought hated buying gas go fast
detroittraders,weekend stock pick stockstowatch barron weekend stock pick dollar tree meta delivery estimate
TESLAGovFunded,rafael ted cruz aluminum foil
the_megawatts,breaking news model come ambient lighting black gemini wheel cover hitting u soon modely mild refresh
