Username,Content
LI3AModelS,bought drive
KarenV35692848,big thing taken consideration calculation worker get stock many worker become wealthy huge perk
KureWellness,biden would say year
yramkee,game whether ev incentive ev mostly win better car
hikingskiing,predict ultimately able assemble vehicle lt hour
BeneluxTesla,tbh think wait enable local law say point failure want collect much data possible within app could wrong explanation
TeslaHipster,reported
HRMNicole,neuralink unless open school
TeslaExplained,agree make sense way
Percy1472,get electricity charge coal natural gas really stupid combine roof powerwall literally driving sunshine literally make sense thanks elon
TeslaBallsdeep,justin trudeau replacement progresse
Tesla654,hakuspecify
Fairestisles,lol yeah panasonic make battery lack research post
Lrawsignal,oh burn
Tucci2000,best video seen
unsignedhypepro,happy sunday averts government shutdown job report ism pmi survey fed speaker delivery may trading god ughinvestments
SawyerMerritt,news home san diego virtual power plant
Kromek6,thanks san diego gas electric application accepted
TeslaSynopsis,trump least respect elon unlike sleepy joe
Rime_and_Reason,want find secret universe think term energy frequency nikola fema fcc plan nationwide emergency alert test
rachellee221,watching charging drinking entertainment make spent charging go quickly
the_megawatts,elon see post
VipRoseTr,great news owner
TeslaTex22,climate crisis care age block rarely vote
PollsTesla,
fellardass,many say cybertruck modeled barrel chest
TeslaBallsdeep,dreaming obvs
FpuntoF,mini city centre
pablo9948967714,jay leno test raglan land rover defender tsla raglan raglan company formed veteran whose mission today converting classic land rover run battery conversion based original defender featured latest episode jay leno garage company founder joe comiskey hand present jay leno raglan conversion feature mix proprietary technology running gear single motor taken old tesla paired raglan gearset inverter suit defender retains mechanical system result peak output hp enough mph acceleration five second according company raglan setting throttle response purposely set deliver linear feel matching original driving experience comiskey said team spent lot developing vehicle also various driving mode including ability switch regenerative braking battery unit raglan estimate deliver mile charge maintain weight balance original vehicle battery located hood remainder placed vehicle support dc fast charging included case full charge require around minute raglan based wilmington north carolina vehicle take roughly hour build lot work involved raglan work start finish powertrain company also restores rest vehicle original part typically retained buyer number personalization option case vehicle sampled leno convertible top plus connolly leather trim comiskey point leather used early land rover modern audio climate infotainment system also fitted please repost follow back ifb
BeneluxTesla,awesome speed getting
TeslaSynopsis,plaid
lefty_q,dew work fist pulling energy ionosphere look nickoli death ray research haarp saw would pray look similar clouda lighning turkey earthquake
ElonMuskAOC,crazy lightning storm western australia would saw
Fairestisles,make battery actually get panasonic
ArtVand46368680,seen many time never disappointed
JoeBlow32754855,currently sued toxic racist work environment elon white nationalist fascist propagandist purchased twitter allow white nationalist fascist tweet whatever dangerously divisive disgustingly deceitful hate mongering propaganda desire
eeclarkjr,probability blame
WastingTime82,literally showed overview video telling people financially insane buy anything become robotaxis end make owner dollar per year profit last three year con
scottz2000,nope programmed key card open
Fuzhongwei_cn,best technology
_Falcon_Fury,think may missing trim piece
TeslaTomMY1,november sound even better
TeslaRaijin,boruto good character
hamster_coinsir,
TeslaHipster,sexy gratz
AleAgoPiaggio,well market final say oems increase ev price public much subtle way control whole manufacturing marketing texan lithium refinery also control big part supply chain others plus increase manufacturing cost affect ice car much ev built much much hand work keep digging graf could last
TeslaTonight,current jackpot cash option stock
jonbbc,cool see
eliasmrtnz1,datainsights fsdbeta progress look logarithmic scale included mile disengagement de drive de based request
TeslaBallsdeep,pain got everyday month hitting refresh button finally
TeslaTex22,tight fit supercharger space
Clypeus_Lupus,phone
valerioshi_,bro begging wl
EZ_Breesy,look cybertruck elon eventually obliterate terrible decision could first market year ago regular pick printed cash
allEVehicles,model performance model give bada halloween vibe price range mile est mile type crossover seat awd trim performance exterior pearlcoat black accent interior customized location illinois vin stock go electric check feature chicago autoplace downer grove il
Seeker1Watching,unlock akashic record nikola frequency remember via
Shane_BSer,many town part easily pop good idea
ZanthTK,feel dumpster diver tech put business instead focusing advancing living destructive path
BeneluxTesla,sure
TravelTeslaDad,happy birthday
Schnabeltier18,course drown people never valued customer able buy ticket moon right
WSJ,ceo elon stoked hope spring cybertruck would finally arrive third quarter turn buyer going wait little longer
ffadi14,closed app honestly still believe possibly german investor advisor wrote please tell ironic able sleep tonight
_ram_you,imagine edison early innovation took ugly power cable cleaner air electric vehicle century sadly profit stifled progress
LI3AModelS,nice love mine
TeslaPRGuy,lol afraid even coming city guy afraid everything
loverjunior2000,trust
Blessedchong,benner cycle anomaly tell u could year pick high beta stock ride next cycle interest rate downward trajectory could pan well ai phase kick ai
diegoarmandoAD,damn would love work marketing 𝕏 dream
m8nimal,sad day owner outside north confirmed unece eu regulation delayed creeping looking possible availability activation eu country around january moment silence pls
jboschayguade,run linux o apparently
WayneLewy_,always competitive pressure mkt main competition gas car bevs go china well sale including phice vehicle consist gas car remain foreseeable future
MopedPurple,long dumb auto maker go business think pay somebody pay others make vehicle
krskipp,evidence contrary clearly hit clearly reversed back impact also mean hand unseen adding risk danger due firearm suspicion
TeslaChillMode,true still reported tho
GearMusk,begin delivering vehicle fsd beta
TruthfulDAMS,space x
bouakkezmohamed,true people love many raisons
PollsTesla,thirsty ho workout
vashon522,stock
AbelRod65364433,hi question deleaship south africa
aravindkb16_,design could normal truck feature
kenlipartito,firing long range sniper rifle make much sense putting internal combustion engine mean probably fool would
scitechk,absolutely ca wait see elon revolutionizing exploration water maybe day submarine innovationatitsfinest
BeneluxTesla,selling really good china tho
NiceisRich,well fargo finance vehicle
JSHIO4,ambient lighting sad
LogicTesla,goodomensfanart white night
LogicTesla,goodomensfanart black snow
TeslaStadium,unreal sport reporting
AdamSchefter,taylor swift put travis kelce map past week kelce gained instagram follower top nfl player combined per gained follower september following three super bowl played combined nfl player gained second instagram follower last week jason kelce added
AndyZeGerman,relation vin diesel stunt wise
TeslaTex22,worry sending thousand way texas enjoy
AwokeKnowing,clueless free market democrat lost fascist central planning authoritarian bent never expected win government mandated winning people want better
EstherKokkelman,supercharging
Gimicks0700,abeg drop sharp need hear full version boi play snippet tire
DinoPozo,thanks
Ronnie_Bikes,interest context pick model rate boe base rate higher writing
PelafigueJ77116,number lawsuit weather imagine motorcycle
billy37767989,fall cliff
lovetesla2030,true
VipRoseTr,preparing week ahead stock market tsla delivery costco cost sale number radar
JoseRicaurteJ,case missed sawyermerritt elon became ceo year ago month
0taroff0,purchased
BLKMDL3,lmfao impersonator idiot
BoochaDon,german feel u bombing nordstream fact elon major topic say everything medium u definitely hypocrite easily controlled medium group think
RockerKevin,elon became ceo year ago month
RockerKevin,zeekr sell ev four country middle east delivery coming quickly
TeslaTex22,clown never even single bill passed congress
SHale1963,public company audited yearly
donmfeeney,already tell constructive thing think appreciates level sidekick could ultimately force good great job somehow fell thru apply prob anything else work elon
DinoPozo,seems crystal ray ship taking model port amwerp leaf suez canal information crossing finger
jonbbc,enjoying similar led experience model year basenor light look stock moment
RyanTanaka3,neuralink x boring ai spacex
TeslaTomMY1,anyone humanity
tesla157,happy independence day
TeslaPatri66930,slow ordered reservation get
Lithium_Wave,build build million time speed
0xPapakaya,bought best bang buck riding oems going back year
Tesla780,hilarious imagine talking affordability electricity ucp failed policy driven electricity rate sky high compared rest canada real alberta advantage
Profbeakercbe,mate theyve got bit catching handle well build quality feel european sport amg merc yet beaten ev tried drag motorway far
E_Vehicles_Aura,video reveals model overtaking chevrolet corvette drag race
Factschaser,well went biden newsom taxpayer funded tax credit saved tsla true ev competition getting crushed
Factschaser,volkswagen bevs continued dominance norway sweden august vw brand audi cupra skoda vw many share common vw ev platform handily outsold model sweden norway vw beat tsla june july
Smoked_Bear,thought leaving platform go get drive mexico
TeslaSynopsis,common hop shoulder
Bill33525,talking rep said think suc network income beat revenue eventually
TheTeslaThomas,look good
Chris_D_Kerr,unless twat buying electric anyway haha
zoeharcombe,reason buy ev expensive rape world precious often involving child labour guarantee get b guarantee charging point use con without wiping mileage range get insurance
ja_pirwot,elon open donut shop free donut premium member
TeslaTex22,two loser
TeslaTex22,job clown
Christo98189615,start chew rock
Seattle_RT,hey slipper billionaire rich
SawyerMerritt,news delivering car fsd installed update required
shadowkkkj,x twitter seems elon trying write something lmao
cb_doge,get chance work elon company would choose
gone_gordon,stock declining worker want higher pay uaw offer
Jake__30__,guy actually enjoying saying make kid like cheap labour
sallore102,owns
unusual_whales,aoc said want trade tsla ev
NoahNattin,austin texas
Allin_on_Tesla,charge home never visit station unless case need stop every four hour eat drink use toilet add mile range minute
gone_gordon,stock declining byd largest maker pure bevs make million pure bevs year whole seperate phev line big already falling behind
Factschaser,lol competition came face bro
Factschaser,volkswagen bevs continued dominance norway sweden august vw brand audi cupra skoda vw many share common vw ev platform handily outsold model sweden norway vw beat tsla june july
LoneS_tarr,r would possible entire project implement factory brazil lot left
ICannot_Enough,rate obvs
TeslaTex22,spanish
invest_answers,thank much nasty people
PeerGroupInvest,stock option worker already get paid lot barclays wage go amidst fallout uaw strike via teslarati
owennoble81,took attempt need sling
MalteLandwehr,getter better quality comfort reliability etc model ahead industry acceleration reach etc never quality reliability comfort etc
MaddieJ16102499,twitter man owns space x among others
tesladeoudan,dinosaur street drumheller downtown
rasingh73,ah classic switcheroo joyriding suddenly championing union worker strike bit spotlight perhaps convenientactivism
cokomodo,look updated modely built gigafactory shanghai
WastingTime82,saying aim exactly saying said conman lying entire life logical thing completely ignore
TeslaAndroid,say goodbye ribbon corner android display replaced simple setting icon thing show area well example notification system update waiting download sold design yet
badboy008167634,someone tell story behind everyone calling girl
Jr_Reynolds3,think prolly go wherever needed would understand place
Messengertsi,would first
shariq911,funny time truth bitter good reason building electric army tank fighter jet sirrr fighter jet think environmentally friendly humor epic
BecklerMac,agree solar panel ev think economics different ev require fewer part le labor input manufacturer deal ice product line major advantage vehicle china becoming writ large
j_taelyn,first def leppard styx best bad omen last bad omen
mygomens,first direction best bad omen last bad omen
Commuternyc,number readily available clearly never looked tsla tslaq sunday
antitesla26May,dignity corrupt league
espiegler,point champion free twitter careful moderate content pissing government could threaten sale isaacson press
Hilbe,report back motorcycle guy found interesting take back first got plan
tesla4the,congratulation
ray4tesla,wait
ray4tesla,thanks john panzavecchia incredible footage fire fighter battling blaze literally got blown away gas tank explodes see ice magnitude wait ice short explode hat heroic fighter
NipunaPamudith2,self driving motorcycle
lovetesla2030,glad calling
tocxoan6,currently many ceo large company technology industry often known large salary benefit elon ceo spacex example
FckedLynx,mean dont jeff bezos dropping swat team hell storming complex
TeslaEarth_Org,buy case second flipper
fllessur,thought charging would worse charging phone day park walk house even think put charger
Allin_on_Tesla,calculation correct expensive petrol uk currently litre
tesladeoudan,miracle reuniting elderly couple met ontario chatted lunch
Rob33McC,main stream news self drive semi tire
alinthemind,china receives priority update due declining market share highly competitive chinese market positioning neither premium budget vehicle contrast enjoys status u making update le priority
montana_skeptic,take look compare iihs data vehicle strongly suspect wrote year ago car compared make dangerous killer owner others
icapulet,updated newest verified autopilot death disclosed latest nhtsa sgo release total autopilot death stand death far tslaq
TeslaDeathRay,lmao dod requisition starlink defense production act
alinthemind,china receives priority update due declining market share highly competitive chinese market positioning neither premium budget vehicle contrast enjoys status u making update le priority
LondonMozo,true super bullish free elon curse
AleAgoPiaggio,better may wrong different take quarter china built car august july june roughly average former three month likely built decent inventory shutting line shift highland sold half september delivery production highland inventory building week could short august could mean may deliver le vehicle assuming efficiency improvement inventory wiped would mean car exactly w number right
caires_peter,none need better curb protection
antitesla26May,deadline missed watch share plummet tomorrow
TeslaTonight,almost read way post jeez much little debacle
TheLastAesir,thus buy
ukevowners,panel powerwall ive work year thats pay day im skint must shredding wage
TeslaSynopsis,love positivity
NichStarling,another driver proving manner waiting pick kid event rather everyone else guy parked front deliberately blurred picture
tklcstg2002,elon wo make motorcycle agree
teslaownersSV,elon make motorcycle agree
FarraHrag,bed turkey azerbaijan probably plant
StevenHosmann,nicole steven hawkins einstein lol
GailAlfarATX,ai come long way since speed progress awesome
Tesla,vision us path prediction accurately predict road extend even see around corner
allegro1950,result dealer network distribute vehicle service recall
cheerful_ExGF,expensive private school area student recreate downtown model building parent actually work look architectural model done professional child
maggiejuang1,silicon valley milpitas home apple oracle nvidia world skilled human work force ever seen trillion dollar company champion innovation good thing woke idea way make living
JamesVictorino2,government investigating elon since trump alleged fraud related investigation result evidence grand jury next phase therefore past investigation phase
JohnDemma_,red accent wall plus stainless steel logo
lisaktownsend13,work
markMay58289639,else make compelling ev go mg
Hermi05028900,gadaffi would hear version nelson mandela nicola rediscovered scalar wave still get rich used everyone
ray4tesla,really
ray4tesla,thanks john panzavecchia incredible footage fire fighter battling blaze literally got blown away gas tank explodes see ice magnitude wait ice short explode hat heroic fighter
watawatadayone,would request translation specialized team directly supervision
CrowM68,ev suck
antitesla26May,british even educated
SkySportsPL,
NIK0la__tesla,outubro meudeus outubro fell love october omg socorro
Millionscapital,tsla launched updated version model china change starting price tsla modely electriccars stockmarket
B_Ball_Johnny,auto worker set adrift trump trying get vote collapse big auto directly caused nothing stop people done gas rather trump biden day
SmallGov4All,sam shop say farewell market share
Buffy2slay,love work space x neura link boring company engineering physic skill snd knowledge love work x programming software knowledge guess il tea biscuity lady
SamRoy92,actual harm think elon
lunchtime100,yeah elon totally comparable hilter
NodiMend,lol deny impact rest early stage
tesla4the,especially bank print money thin air lehman brother mess eye opener messed government allowing bank power
OpenskiesX,sincerely believe banking establishment dangerous standing
billydumaurier,keep longer strike better honda toyota mercedes hyundai kia etc course american public
smaeung,hyundai finance come interest buy offer
destroyed4com4t,hell go step say episode exception original eight episode ovum bubblegum crisis unapologetically queer exceptional episode body horror smart possessing driver christene
MarcdonaldOkor1,unity peter obi advocated apc used tribalism religion divide u elon lisaxcrazyhorseparis canelocharlo rkcaja deprem sundayvibes
itsrealgopi,find logo
divya_duraisami,
tesla_lion,smart
unusual_whales,powerball winner bought million la mansion billion win per nyp bought two mansion california month million estate hollywood hill million mansion view san gabriel mountain
ordrsofmgnitude,refreshes model ambient light wheel could seen vehicle order page base model giga shanghai feature black gemini wheel slightly faster second ambient lighting form led strip span dashboard teslamodely gigashanghai
GolubicStephen,work meeting blown away little everyone knew got brought probably created sale conversation growth unlimited
ray4tesla,say ice fire le violent controllable ev fire happens spread fuel tank
ray4tesla,thanks john panzavecchia incredible footage fire fighter battling blaze literally got blown away gas tank explodes see ice magnitude wait ice short explode hat heroic fighter
NSIguy,working tech mould underbody piece shanghai security news report ev manufacturing
madamekose,told guy
HugeHugeHug,fully green hybrid cover efficiency battery plus gas go needed waste red cell cover mile instead make many energy efficient phevs battery
cryptpwlodek,bro love
GaryLovesTesla,alive
LIVEpositivity,something look forward every single day
STittayz,think person working removing instead
antitesla26May,british even educated
Jimmyjo97422646,possibility maxor meowing
DesaiKaushal,alloy wheel need black edge doable plastidip version edge soon
DinoPozo,second first
FinancialLit23,analyzing monthly chart tsla see downtrend shattered crossing uptrend price reacted strongly upward shift considering tight stop loss target spread word follow comment retweet
TeslaManny,get crane ready
EJovi1025,beat california approval automated driving tech reuters
TheTeslaLife,lead country commit phasing gas vehicle look country commitment
TeslaAIBot,interesting lot thing disappeared
tesladeoudan,three major dinosaur museum world remember name albatosaurus first found alberta
TeslaClubAT,force must proud padawan
KhodorMahmoud,second embrace risk staked money spacex year pm backed bold untested idea today flagship feature fear failure path stagnation
FlaTesla,lost brother prematurely last year give kimbal hug tell mean word necessary saying
datascipdx,renting enjoyed premium connectivity provided last three week subscription feature appears expired discern contact hertz regaining premium subscription please advise
Fxhedgers,launch updated model china keep starting price unchanged reuters automaker sunday released updated version model china minor change vehicle exterior interior
NorthStar0077,launch updated model china keep starting price unchanged active trader daily
TeslaManny,wtf
Stanley98063846,need subsidy sell car dollar gas people drift make economic sense
LariD_Fi,true worked stage urging u take vaccine even held raffle people win got vaccinated go twitter act anti vax
zehetmayer7,modely sr get upgrade ambiente lightning white dashboard black gemini performance upgrade old leave vehicle year pricetag lr high
E_Vehicles_Aura,china upgrade model sleek wheel dashboard lighting
cupcake0804,black people elon sued racial abuse electric vehicle plant usa today
GolubicStephen,world wide recession still growing everyone else shrinking go ahead hitch wagon legacy auto deserve
HopDavid41,elon joe parted way biden favored union maker biden case need check balance ditching carbon bipartisan effort hate petty bickering roll sleeve good joe recognizes
B_Ball_Johnny,stop movement ever since destruction people wanted ev filled need trump effect trying save big auto know ca say bc lose vote
DPAutomation,would anyone buy buy
RealCoffeeChoco,want spacex say would cool would x
cb_doge,get chance work elon company would choose
TeslaManny,played fafo
elonmusknewsfan,get ready week ahead stock market tsla delivery costco cost sale number along much much incoming catalyst watch help get
myraccoonhands,actually immigrate legally even admits elon illegal immigrant trump way would kicked usa never founded paypal motor spacex solar city
Allin_on_Tesla,ismo leikola laugh factory final funniest person world
Psilocydave,haha nothing wrong
CPetrovai,love fudders need perfect timming fudders space team per week pls fud u
TeslaClubAT,knob knob
OptimusK69420,missing part
GaryLovesTesla,old say say learn greatest lesson part growing wiser
cvalente28,greatest lesson hardship came
BudBots,confuse little ban gas powered car support legacy auto support strike brag america largest auto producer senile worstpresidentever
AtomAntEater,gm
kingkongsport,fake dan aoc drive right dan dan canuck aoc con
WallStreetApes,anyone greta thunberg aoc climate cult outrage
MrTeslaX,let check lucky
__3_much,really debating getting next stay cedes go
MarsF8TC,tantilise awai something brave tomorrow go jw hall easily found searching app phone great day regard
TeslaManny,nothing wrong cop didi played fafo
StockMKTNewz,get ready week ahead stock market tsla delivery costco cost sale number along much much incoming catalyst watch help get
javichisco,spacex cooler one
iSafeRide1,big move month
Actress_Gall,trending girl
prmatthew07,think miss delivery number tomorrow morning
mehrensp7,sadly correct never buy ice manufacturer
onewordtrader,hope please go germany company germany full dump head moment worth producing car perhaps leave germany factory chance bigger get government people realize
kevinonymous,go ask employee company stock rather compensated top hourly wage
OrionwebsterSam,nothing could done lithium battery fire emits via
toivtelia,short driven mmat cent ridiculous low price coming get distracted
gs44236,joke representative pacifica country club membership etc get elected
karinmuc,would also
connordinnadge,nice look awesome
TheDKReturns,fanboy pay twitter ai art avi joke write
JasonccATX,tomorrow open another investigation
LogholicX,tag fucking fortnite
TeslaNapkinMath,accounting expert included subsidy direct labour car therefore ended nett number
andenmattenlaw,move austin texas try get job detroit wo making many car
TeslaSynopsis,good morning sending good vibe
akhil_k_thomas,would go work optimus robot
bryanlharris,program bot sending daycare
sharkastic,owner considered third party theft policy leaving fire component might save money
guardian,quote electric vehicle owner face soaring insurance cost
ll2625,electric zero carbon airplane
sophielouisecc,single photo sum stop oil better
mattvatcher,cybertruck price
sarticee,reason he politician he charge involved anything fuck going place mfers hoping begging shit cause there god damn reason
fuckyouiquit,richest man earth looking poorest people earth political photo shoot
roxalot58,people coming rob piliage stop surge migration persuade corrupt govt official crack crime open couple factory stop blaming go actual criminal
B_Ball_Johnny,said people buy whatever want far range comment based non ev people exaggerating ev transition happen matter say big auto dead already collapsed anyway see
pokemonho98,percent right range electric car far le gas diesel common sense doesnt exist guy think ur saving world really killing
FlaTesla,sometimes feel unh unh
EastBayFocused,go visit dublin ca service center suck never buy another focus shit
bigbull_meme,may see lot bug driving india cuz people use old method travelling issue driving auto pilot mode indian road
