Username,Content
marktwaalfhoven,drove boston newport ri door door fsd family great relaxing safe fun must certainly fun weekend describes family
BlackTesla110th,charlo hugging as sucka
IntoTheTesla,doubt happen soon
tonycdonofrio,insightful video may big winner uaw strike elon could emerge winner uaw strike detroit automaker ford gm stellantis
TeslaTruckClub,honest legacy auto executive imo suck uaw thing holding back
TheTeslaBull,chief pup
tesla_fix,watch awesome video model highland
Tesla_Asia,continuously seek way improve ownership experience
b_neckson,wow favorite best choir heart
OldMateEngineer,aero dynamic motorcycle easily lend electrification
lovindubai,dubai upping game video driverless delivering coffee dubai going viral honestly understandable vid via x
TeslaBest,video best selling model stod ev sold u enjoy
ev2car,highlight model engineered fun drive best model far post outline think upgraded model fun appeared first driven
BelovedBrands,uncover utilized brand positioning stand automotive industry elonmusk brandpositioning
JonnyKrens,wow guy love drink jizz
evannex_com,style meet substance caliper cover upgrade model look redefine take word carmods teslalife autostyle electricdrive carlifestyle evannexmods teslaglowup calipercouture
FrankDelson1,create
PitchforkGame,make sense covid anything ev purchase would ev safer gas powered vehicle
Magnummmm0095,actually listening anf appreciating input podcast economic topic becomes hard differentiate political nonsense argument making incredible
piloly,initially estimate matter anymore right latest estimate priced
Changkuo,love would love read
whatcar,let get review model
AHCDMV,unlock full power solar production app start cashing srecs today
Factschaser,file complaint nhtsa take second online state attorney general far many tsla owner getting musked
Factschaser,since started tracking got musked seen kind surge complaint seeing record delivery record number defective tsla vehicle returned got musked notoriously incompetent service center
ICannot_Enough,part finally take top model tab show forecast production delivery inventory stage detailed tsla earnings forecast model
FrankDelson1,create
TimboNotes,think avg owner buy either speed convenience safety buy tesla
Michael_W_77,wrong even safest driver earth driver crash eventually
KCCT12,accident german fabric post
Pipsqueak1404,purchased used driver door malfuntioned ca get without climbing across passenger side remain way afford get fixed literally ca get via driver door think
zoeharcombe,reason buy ev expensive rape world precious often involving child labour guarantee get b guarantee charging point use con without wiping mileage range get insurance
raamaanandh,add coil lightning claw authentic lightning arc p
allenbaylus,lost pedo guy started look see happened imagine surprise learn founder
stockblueprints,stock case artificial intelligence investor business daily gstc amih smme
TeslaTaser,team line shotgun formation pull guard planning kneel opposing line going whole play
sadone_mike,video show model go chevrolet corvette drag race see get left dust via
TushFrezo,elon say bluetooth boy want key
Mari4Trump2024,einstein u space program original rocket man
omega75,well engineering china work let fud
DirtyTesLa,long ago bit sitting boat nothing help stick
PirateBastidWe1,nothing impressive population wy le people per square mile meeting attend project work spacex belief value representative general population please stay politics
ATTITUDEMASTE10,back
teslapt1,look fucking lag almost second lag smoothens data used decision making purely benefit visualization
mike48506837264,definitely got cover became publicly prominent besides maker really came answer within last year either pay luxury ev buy low end
Commuternyc,notice brake light continues forward tsla tslaq sunday
TeslaqJ,selbst durchbrechen
MSstjernholm,lowering price confirmation margin future chess move scale rational always trust mission come first money simply follows result thing right long term
VijayVi52875705,love
IntoTheTesla,cybertruck spotting tsla f gm
omg_tesla,laguna
ObeyYaweh,violet ray therapy resonance
TeslaTakesOver,lee major looked elvis
Anthony77696673,way sport electric car reproducing muscle car musclecar musclecars
kae_verens,charging galway atm charging bay next charging stopped working phone tech support door open glove compartment break break
Being_detached,remember around million people buy year small number ev future fight loose election remain neutral energy rather bashing ev
RonDeSantis,president reverse biden mandate electric vehicle save american automobile able purchase best wrong washington elite state california tell kind buy
sporglefork,large cast part toyota introducing going bitch half replace get damaged expect spike rate car market
Tesla___fan,beautiful congrats let u different fsd m v
Spartan00113,fault ca afford let subsidy slide competitor fact electricity production come fossil plant could depend le
HSternfan01,oh cool thailand service center open
cawffea,wait coil telescope
qzkhtw,unselected auto wiper beta appears reduced dry wipe wiper still work sensing water widow
someguymayber,guy stock rq
elonmusk,silly metric giant pile cash really stock company instrumental creating technically lose way every stock randomly drop
philippesibelly,stopped reading led visionary genius behind spacex elon
GrandCentralFan,sit terry give u follow fantasy football advice throughout season
PatrickLuFuchs,forget ride around selfe driving taxi since zipping city city vacuum tube
TeslaTakesOver,obsessed perfection
Bertinskiii,pursuit next iphone battery
watawatadayone,beautiful
TeslaTaser,fan psu franklin mean absolutely right last seen team take knee shotgun pull guard immediately snap faked knee kneel formation problem otherwise job stop
Akashrashmikaa,understood fan need
BillJr212,bigger investment big impact garage door track follow wall ceiling great ceiling height would make garage feel huge
whales1212,stop childish give honour honour due know well keep ignoring
MissJilianne,nation largest electric vehicle manufacturer president joe biden
OnyedikaPe69449,ceo elon continues hold title world richest person net worth skyrocketing billion astounding billion
cawffea,want coil
jillu_offl,love
greg_j_davis,ca argue still love
MyLifeFrAiur,wow acknowledged lol
Jamie_23Dene,still would trust buying used year old clock
TeslaTakesOver,say right
Commuternyc,thread thread reader app tsla tslaq
JimmyCal_Tesla,pick mclaurin zay flower josh palmer higgins today thanks askfft
lemekeosborn1,einstein isaac newton nicolai formed theory law physic yet believed go history simply
RickTeslaWav,fsd uk yet
stratoakmond,ca avoid eu probe nio cry fake news week ev
mayfred_osei,month agenda hashtag present failed leader day occupyjulorbihouse
FrankJoosten,believe guy fall staged speech put couple guy vest behind appeal voter phony crap american made car
only2gendersK,rapist murderer googled arm rape could find poor bring proof please
watawatadayone,thank wonderful story
tim_daugherty,long gamble away fine shirt still winner
laraibnaseer,going mar
valdpuff,weekend evening ride
wCherryBlossoms,always
NealDneal7,must
ithinkheslying,strange address title lol cool thing electric mechanic current scene anyone want learn basically start scratch though sure background needed
BrenVpaintings,einstein helen troy need intellectual conversation appreciates beauty
BKabutey,owusu next occuoyjulorbihouse
roboe68,jackass could wear hat
bulldogs4ever2,surprise upside leave bear
TeslaTakesOver,doggie adorable
Spartan00113,intent purpose company even elon wanted give away free car money come somewhere
adjeiwa_,data bundle expensive mtn vodafone trash eh ei thanks occupyjulorbihouse
Somethi41134031,yeah back historical average rate particularly high right
TeslaDanger,gon tell kid samson bible haha
twohealthbars,tekken look
Xenius101,want send picture
handygas,sandy munro trail destruction via
missshrey_,
icemankimi1991,seems server people asked problem supercharger longer displayed app least brand
rjward1775,reducing removing incentive hurt legacy since price competitive
robertSPD,saving life human sth worse aware german history greeting border supporting good business hate electric car saying
BillJr212,add extension cord reel ceiling add air hose reel ceiling hard pipe compressor tucked away corner basement paint wall light color stark white went gray came fantastic
itz_vignesh_07,addicted view
alecfisher01,think free speech mean even enemy stay platform fast forward banned critic platform
apozyx,mind business right
MMeow_Matt,ordered fucking
stephandrouin,lol plan model performance fsd
RockerKevin,elon wealth grows billion stock year nairametrics
RockerKevin,uaw strike could impact business insider
YammerTime01,notification count broken
KrestTest,bullish
TeslaTakesOver,
ColMorrisDavis,hq canada manufacturing facility u building third go production state washington
tesla_will_win,look great link
Eric_Savard9,free energy right would love see
FecnNews,nothing could done lithium battery fire emits via
YammerTime01,expensive unprofitable internet service fill night sky space junk humanity tm added ironically nearly everything elon
jchybow,hater say elon done anything humanity literally even look without spying direct evidence impact world
einsla_,clearly mine clearly lab
davestern007,agree motorcycle dangerous
Dinesh_dear3517,brand ambassador
Being_detached,remember million people u buy year number grow next year small group accepted ev subsidy played role even without ev adoption increasing careful joke
BLKMDL3,really think trump ever electric misinformation make apparent
GailAlfarATX,beautiful usa truly awesome think elon accomplished spacex neuralink x came usa place earth could build company
teovito,often hear people say united state seems empire see country energy independent home world leading company birthplace ai sends aircraft space country built core entrepreneurship spending r seems united state getting started
KarloTheGreener,well would mind tho
EvanDownUnder,motorcycle need noise le completely unsafe
TeslaAndDoge,catching train interlaken
teslinvest,congrats beautiful
jinsyu,sound fun
TeslaNewswire,according insight refreshed model could finally bring confirmed improved noise vibration reduction us although chinese version always equipped modely china hype
ChrisZheng001,product iteration fragmented even term hardware addition ambient light drive unit wheel model also brings nvh reduction kit
Xenius101,heard jackshaft garage door inkind current us tesla support
DHASTY008,hair wheel
Tallandfree3,cultist ignore everything dave say average price double digit guy avg price
TeslaEuskadi,race week
TeslaFSD,wheel dope nope
oshomaniac,special edition self driving bhai ok
rickeygoodson1,think point fatal
GordilloSaunier,dream reality great
JZiv_nobullfact,cool
TeslaEuskadi,race week
mikhaele_ible,catch making phone trying catch apple lol
L0SCH,necessary integration anything remotely close
mattniandi,wow almost fell chair actually used word favourable way
zilevandamme,equal employment opportunity commission dropped bombshell lawsuit electric company lawsuit alleges company allowed pervasive racial harassment black employee fremont california
TuttleNanabelle,forgiven
nikolateslaaaaa,raging bull
MP_InTheMoney,comment guy posted information post nothing research pump stock passed everyone loses money stock others got early saying research
TeslaTakesOver,mom boy love detail described photo oldest son elon chapter book plan finish today
ReutersUS,launch updated model china keep starting price unchanged
BubbaJumpInc,enable fsd unless rider asks
EchoSiedel4540,good morning everyone elon called bill gate categorically insane e core shorted stock according fortune
jeraldvj45,inspiration logo sir
dhivya_dhurai,
AviAgrawaal,clear reasoning justifying valuation survive wallstreet nick co
Melonnnusque,elonsucks sued severe harassment black worker california plant federal civil right agency claim lawsuit employee subjected racist slur graffiti including noose
sg_andrea,bought first ev never choice
txleeroy,solar roof waste charging much expensive replace plus block view agree stopped innovating
TeslaPatriot,true
b2j135,every bot need compatible lol
RapDose,forget exist
savv90737174,dude checked ct reservation config detail gone re definitely late party owner year recently added solar also tri awd config
DaveNel52767710,promptly returned taxpayer subsidized cranked da capital
Teslayouknow,breaking launched updated model giga shanghai feature ambient lighting textile dashboard material wood black gemini wheel
FinLitBae,vehicle next turn
Commuternyc,lol much bull want u get amnesia think robot company made manikin fake video want robot company buy boston dynamic want underperforming equity stock tsla tslaq
heydave7,bigger picture robotaxi optimus sure quarter delivery number matter much
12twelvyyy,everyone hating pretty talented hate laughter
TheXCurve,motorbike bad aero dynamic highway speed
IntoTheTesla,gemini wheel model looking way better prefer tsla f gm
Tslachan,tsla giga shanghai gemini wheel almost black looking cooler factory introduced soon think changed design
YouMeWhoYou,burning investor money something benefit race team busy making hundred thousand car
PaulOMahony5,take vw clearly due nazi connection anti based politics must surely anti vw mention emission scandal
Tesla_Calle,bonus
xlly56946652,delivery update
MattyKoebel,said started paypal reusable rocket said huge team elon always praising team spacex x
KelelaSB,hear make reference partnership said customer ev referring ford customer liking ford ev bought
StewKraine,asshole world dumb enough ev company go hard right left buy piece shit traitor enjoy selling right ev elonmuskisatraitor every ukrainian murdered worth fucking bitch
Zxcxz_xyz,installed solar roof three time ev climatechange renewables renewableenergy
PaulHPowell13,agree looking people show interest least interested learn really interested sought community hopefully bore follower much share sport team bore sport follower way see people choose follow main thing toxic build
JoshuaThePilot,vehicle make small portion greenhouse gas fact say america went ev would make small dent country china etc make better vehicle clearly currently govt need stay lot thing believe thing
23Pdan,community note dan watch whole video least pay intern watch jumping unto conclusion false narrative virtue signaling scheming mind play trick
Tesla_Calle,sorry delay happen
Bockerer2,
coolcorey13755,guess check hitler investment portfolio
brooooo,probability stopping even though brake stepped
TheTeslaBull,drove past model yesterday jaw dropping even wife wow hot
whateve70487138,californian earn shifting towards ev model cost california cheapest state
skilly_tweet,absolutely man
alex_avoigt,driving model without stalk month love never single problem need stalk need turn steering wheel roundabout either problem björn made mistake using car control already sad see bjorn use without stalk wish best learn issue invented people trouble adapting innovation approach hard learning
coolcorey13755,ridiculous internet value opinion
Sathya14324,mention
guyday77,try get personal friend mine share retweet please grateful content thus subscriber
itsmrdoodle,hey doodled
jefH1432000,bet make loss bankrupt another badly thought business
write2convert,ca ever independent always need someone else something even indirectly need example nikola hated near people talked pigeon still needed someone make material invention
riggins1169,replace overhead garage door opener jackshaft mounted remove hanging mid air finish drywall paint epoxy floor
KelleMccan,owner think would take flight elon
AbordAlessandro,private jet service rich dog owner condemned climate campaigner agree way travel uk via eurotunnel dog allowed eurostar many would travel train go italy every year
TheTeslaBull,let see video showing try open locked door first pulling fire alarm
TorgeTerawatt,exactly even hurt still office
moody_btw,look
WorldWideCarsTM,slammed toyota prius spotted japan
MattyKoebel,elon made plan design build reusable rocket struggle achieve goal absofuckinlootly nasa vehicle space station ev ceo admit catch million car model top selling ev globally
nikolateslaaaaa,girl
thenewc0l0mb0,france week surprised see many tesla especially taxi
vodanoj72,actually run spacex rumour employ people keep away fucking something
NorthShorePlaid,p ev made america least one buy
PamBilyeu7,known cc file using applewatch pay never take cc many cc sniper skimmer attached stealing cc info happened u time buying gas
devix195,wow try
TheRoseto,ready sip way youthful bliss try blueberry thyme spritz science meet flavor elixir blueberry valproic acid cellular reprogramming thyme rosmarinic acid antioxidant power create magic minute blend cup blueberry sprig fresh thyme tbsp honey squeeze lemon juice smooth fill glass ice pour blueberry mix top sparkling water garnish lemon slice extra zing embrace goodness nature age gracefully full recipe detail health benefit toast crisp refreshing future every sip blueberrythymespritz antiaging mocktail healthyliving
Sunilhn108,buy
tesla_sir,babcock student complaining
IntoTheTesla,updated model giga shanghai look ambient lighting carried tsla f gm
SawyerMerritt,breaking launched updated model giga shanghai price feature ambient lighting textile dashboard material wood black gemini wheel previously silver change texas model
Flyin18T,news electricvehicles unplugged performance make model badass beadlock capable wheel
kechyelathrive,versus electric vehicle good thing still went date
tapedrone,scary think close something orac voice recognition chatgpt internet need personality saying someone put stuff toughened black fsd basically
RivAngE,way contact software bug android app think contacting local technician reach error whenever send destination app share phone language eng
RWAgemdigger,great hear matter depin narrative go mainstream wnt recognised key player inside ecosystem
_sayan_,done car specifically ev phone laptop set gold standard set bar audio transformed coffee lifestyle gold standard branding innovation product
pmsyyz,price see website price sell price drop every day sell
SP_MYP,guessing definitely possible place considering wood trim size software power source
Stocks_NT,well statistically skoda vehicle stolen vehicle therefore even today insurance vehicle cost others reason work way around example expect corporate greed course
_rhikki_,babcock lecturer keep proving happy home set class sunday wife side chick something
WhozeYerDadE,george washington gandhi
MettaBhavana1,rep went genius visionary dumbest plank wood planet bought twitter several speculated died crash current avatar hired keep company afloat gone rogue
MalcolmNance,idiot gun barrett cal bmg sniper rifle meant long distance precision weapon scope properly aim wasted stabilizing bipod rear monopod eye moron driving air guitar intended purpose shooting literally nothing bc hit nothing weapon way fixhimjesus
hari_dfan_,real brand holder
Dannyspeed165,got email sale advisor calling model highland uk
TheTeslaAfrican,great wall arsenal arsenal
EnglishJaun,sale increased september france
chargingchatter,thought leading way shocking incident involving two brother happening world ev company check news
Yazizevil,every song slapped tho cept didnt listen valid opinion
pelabursaham,xpeng best performing stock among china major year including nio worst performer
TeslaInfoCom,inventory count u ago ago ago europe ago ago ago row ago ago ago full stats
Maria53001249,would say maybe julius caesar narcissist might insight sun tzu art war author socrates aristotle philosopher confucius laozi galileo favorite einstein madam curie might insight clean nuclear energy let invite composer bach mozart wild classical music lol let add freud jung cleopatra michelangelo genius artist bernini art group chaotic crazy mind blowing
skilly_tweet,sue mf tsla fsdbeta
alex_read13,make little difference would hasten demise legacy automaker need subsidy stay afloat transition ev remove automaker stop trying world move without never catch
milind_blr,elon met indian pm recently announced planning visit india next year hopefully get india plant started well
everestmotors,big pleasure assisting dear customer louisiana acquiring ride stunning model long range awd glad whitney member everest motor family wish many happy safe mile ahead
PamBilyeu7,toyed buying price hideous charging horror story stopped u got mylr price drop next month put cross country sc bomb glorious plug without credit card
DansTesla,debby downer quite concerning interesting see guidance hopefully nio ramp back make break stock end
iamsenthil_sk,nick name
cousinmerl,he worried forming labor union plus white south african right wing thinking blood er step brother step sister boyfriend family look
Etarniceriu17,data lie always delivery
AnnGree84660124,world grew south hard see black people immigrating another country open elementary school africa instead complaining
IAmSuburban,early year saw semi prototype
TeslaChinaRider,highway stategrid charger known unreliability minimum pile standard parking enforcement often iced even parking lot empty due canopy power range price around
Tesla_Bull_69,sir donald trump
JasonElsom,model frequency map want find secret universe think term energy frequency vibration nikola
mattgrocoff,cheaper mean justified failing ev gm failing worker ceo salary follow worker company success delivers many ev mary ask raise
carmelahas5,thank man integrity vision compassion courage faith please make phone pay crazy price tied
carolinebray82,nice meeting hope leaf get much hate mail haha lucky would drove haha hibarbie colorado amazing ev support team looking forward ndew
itskyleconner,leaf owner corvette owner
CamCovington,along
shnozzmoana,going miss give even rent free space head
NickJean1993,use bedford electrify america charger often almost always problem charger working reduces power favorite setting waiting hour ev charger never thesis problem driving wife
GeogeM3,fair comparison factor stock option vast worth compared f gm may around another round bargaining big got loan prop gm edge bankruptcy loan term ira act removed
Stocks_NT,insurance cost go manufacturer see raise theft reason whatsoever raise insurance cost vehicle stolen
TooMuchPainLord,seen biden either guess many people bumper sticker
guyday77,check model doodled year ago drive around day day
itsmrdoodle,hey doodled
adiyyaan,logo inspiration elon file case trademark infringement
dhivya_dhurai,
DansTesla,nio get back monthly delivery extremely
Ravi80051380,dv thopul
brooooo,demand good build inventory sell maybe financial inventory planning work maybe cfo fired
TeslaNewswire,asia released brand video model highland highlighting feature aggressive exterior design clean interior rgb lighting improved wind road noise reduction immersive audio rear touchscreen display
Tesla_Asia,continuously seek way improve ownership experience
DansTesla,sexy trend unfortunately
TeslaDanger,guy
berthol65314644,motorcycle used ton different application around world city e scooter roller year bicycle
TankTDS,precisely nhtsa data love seeing ai foundation fsd soon replace archaic basic green hill software operation
TheTeslaAfrican,made friend edinburgh scotland nice guy much talker though
JimmyCal_Tesla,dirty as play put whole body weight
strandbrown,always knew apple made mistake releasing iphone finished
brooooo,well original w estimate delivery wrong game repeated discount drive volume still needed w help story upgrading facility truth matter product release happens
2022Honesty,went naysayer back nio get fast forward even year looking sweet
tarantulsa,help directly vehicle eligible tax credit help industry trump opposite
AtomBombCafe,would trust bought twitter kill truth social infrastructure charging station across u funded obama biden never created anything pay pal spacex anoited
arteslabass,think majority people choose fsd option regardless pricing model going put majority people still choose drive unless fsd make money robotaxi
JordanLSutton,look apple boat would sexy angle
JuliusCezarrrr,remember elon said would delivering cyber truck customer well even date scheduled let assume zero trivial volume
uh_duh_bruh,contrast trump post made earlier insinuating biden nice huge deal finally said name gone way snub even doj open multiple trivial lawsuit
berthol65314644,even make battery powered rocket yeah
HansTandt,coming belgium
DansTesla,li xpev might move nio higher sympathy play important see tsla
TeslaOwnersNL,well done slowing even longer tech lagging european maker
FinanzLinksCom,tsla launch updated model china keep starting price unchanged starting price china model company global unchanged yuan
rhensing,much ask
berthol65314644,big lol standard
mlisse,uaw strike chaos good news
TravisH04132807,found ten minute could learn assemble front end model waiting replaced optimus
phonezawphyo,case notice opening supercharger karuizawa big news humbled charge mitsubishi last went popular travel destination owner
s_plaid_369,love
BrianLevinX,try compete ca
thoughtful_dude,day two driving model little thing annoy card key instead key fob pretty cool
navelveriyan_2,arrived
AquaBach3,love could take mandate though shove as
FuWaToRoKaRaAGe,leading way bev software suddenly byd leading bev production bevs existing internal combustion engine manufacturer compete consumer accustomed mass production mass consumption mercy charm existing internal combustion engine manufacturer end purchasing ev produced existing internal combustion engine manufacturer people mainly obtain information internet become aware future potential word mouth end owning bev investing tsla buy bev wo regret
