Username,Content
everestmotors,big pleasure assisting dear customer louisiana acquiring ride stunning model long range awd glad whitney member everest motor family wish many happy safe mile ahead
TeslaDiva99,trying get rest information phone number need scam
jasondowle1,ford experience every ev
kindsimplebrave,think everybody told get rid ziggy get puppy wanted girl dog anyways starting fresh puppy would wonderful sweet cuddle bug instead terror monster
ThatRealTesla,lord love worship prophetelvismbonye happening power prophecy kenya
TeslaGold369,future written star energy story piece consciousness made star
ThatRealTesla,lord love worship prophetelvismbonye happening power prophecy kenya
chukkie58,hopefully put brake fan supporting orange man
stevenmarkryan,want rain anyone parade nothing anyone including orange man bad incl ev impact transition ev commercially inevitable nothing stop transition pace supply compelling ev limiting factor price trend feature performance safety trend year consumer actually need dim choose ice ev relax
ThatRealTesla,lord love worship prophetelvismbonye happening power prophecy kenya
ThatRealTesla,lord love worship prophetelvismbonye happening power prophecy kenya
Pixelfetish,elon wondering africa move single inch year germany backed american support ranked world would quit driving racist comment
ThatRealTesla,lord love worship prophetelvismbonye happening power prophecy kenya
Tesla_Aus,getting married
ThatRealTesla,lord love worship prophetelvismbonye happening power prophecy kenya
QeChannel,qe channel bring world video game animation film become future within anime blockchain videogames create metaverse
ThatRealTesla,lord love worship prophetelvismbonye happening power prophecy kenya
rune_overas,agree maybe future car truck autonomous
ThatRealTesla,lord love worship prophetelvismbonye happening power prophecy kenya
MrTeslaX,nightmare hahaha
ThatRealTesla,lord love worship prophetelvismbonye happening power prophecy kenya
kindsimplebrave,sweet boy would run across beach wordlessly summoned turned monster gone pulling lunging leash barking dog zombie nazi argrntina torturing could control
Tesla_Evolution,jason right way little attention paid gwynne shotwell
jasondebolt,gwynne shotwell particular extremely underrated business leader deserves much credit medium get never heard gwynne say anything first female executive busy outcompeting government including usa china sending rocket space make people aoc look circus clown comparison
ISniffElonsMusk,million vehicle road death incredible
ThatRealTesla,lord love worship prophetelvismbonye happening power prophecy kenya
on_tesla,someone equivalent mean
RockyMtnDoge,bailouts legacy auto american
RonDeSantis,president reverse biden mandate electric vehicle save american automobile able purchase best wrong washington elite state california tell kind buy
ThatRealTesla,lord love worship prophetelvismbonye happening power prophecy kenya
Mol__och,impressive prediction article nikola foreseeing rise modern communication technology mobile phone vision communication device ahead
dtiffroberts,following similar fate nomura banker senior executive american investigation firm kroll banned leaving china european union action chinese ev subsidy target shanghai operation
airleacher,orange man bad win election find way destroy watch lying mission trying get endorsed uaw
airleacher,tramp rant electric vehicle transition sustainable energy battery bad environment windmill work ev go far enough expensive drive minute need charge minute panic charging electric truck fifth range diesel truck ev worse environment electric truck destroy supply chain electric truck power mile range battery take room room left shipment electric boat get electrocuted transition electric vehicle destroying way life oil next year zero effect environment
OspreyOrnery,behind burgeoning demand cobalt key component battery used electronic gadget vehicle heartrending story ten thousand child young seven involved back breaking hazardous mining precious metal
Confessions_404,stan
JoseRicaurteJ,case missed rovercrc still owns bitcoin worth total
Tesla2Lucid,
Tesla_Evolution,true
LucasTerzino,tempted upgrade near future tsla investor contemplated first thought advice welcomed cost effective way go used gt brand
rune_overas,agree u embrace help legacy adopt way
kindsimplebrave,ziggy gone sweetheart well trained puppy terror
tesla_raj,spray
ElonHasNoHAIR,brain rebooting
HullTeslaModel3,heaving inside table sit outdoors
TeslaHaxz,would yall lmao
AApolitical1,love car would love side side quicker yet would likely opt drive much possible
stekkerauto,fun rest professional life
kindsimplebrave,evil creepy horrible fiduciary abusive name rick williams stole much money rick given ziggy somebody watch went vacation argentina ziggy dog got back california
HullTeslaModel3,building part
Njanelarian,since daniel wa bible used pray thrice day using method
ICbicycle,oh really motorbike killing people road nah car
HullTeslaModel3,wow long google duck go aflac tv commercial duck
GoodroeJeff,brick upon turned mist sky something else elon done quite chap well dude
ThatRealTesla,exalt holy name prophetelvismbonye
kindsimplebrave,think ziggy also known zeus also known trouble zigzag zigasaurus rex z zig many nickname raped argentina abusive evil fiduciary used legal role managing money talk
ThatRealTesla,lift hand say love prophetelvismbonye
JoseRicaurteJ,case missed news refreshed model display showroom hillerød denmark going see beauty simon vive
ThatRealTesla,worship jesus prophetelvismbonye
VidasL,congrats
ICbicycle,car kill
tesla_raj,yeah
airleacher,steven sided politics u regarding ev democrat told much lie mission ignored
airleacher,tramp rant electric vehicle transition sustainable energy battery bad environment windmill work ev go far enough expensive drive minute need charge minute panic charging electric truck fifth range diesel truck ev worse environment electric truck destroy supply chain electric truck power mile range battery take room room left shipment electric boat get electrocuted transition electric vehicle destroying way life oil next year zero effect environment
busines73618521,aid aid hiv stopaids rblfcb schlagdenstar bscfcsp koevfb bocbmg seenotrettung plattform schlepperei code böhmermann ulreich meinungsfreiheit ngo merz neutralitätspflicht boateng hafen germany götze mastodon
ThatRealTesla,jesus redeemed u prophetelvismbonye
ThatRealTesla,thank jesus prophetelvismbonye
tesla_raj,posted twice wth took forever post
JoseRicaurteJ,case missed picture taken today delivery center vamdrup denmark fully packed vehicle jesper holm
aishahze,clue man thing cpr rn bang gavel
Brad80sMusic,edison opened door wish lawyer family edison savage greed literally electrocuted elephant talking point hell getting repeatedly kicked elephant
Daniel182392718,etharmy renowned company cryptocurrency nftartwork raised concern carbon footprint opensea different scheme supported crypto doxcoin
parati,mean opportunity manufacturer safe already much fine
HullTeslaModel3,get coffee currently snoring started come back little last night know back morning
bella_artur,cyber truck
TeslaKevin,much get paid spread misinformation
RandallWeb49862,listening motivation case guess verse evil plan pray two side facing jail guilty misdemeanor god court listening fall thru meek mill
jchybow,try
kindsimplebrave,gosh got ta talk beastiality
TESLA_winston,hahah
kindsimplebrave,remember told guy muzzle dog day child killed said alot insult something including stupid slut remember elon said think rape dog mind insulted girl
srikanth_ch15,competition turn rivalry always considered thomas great admirer
3ph3m3r1s,elon need finish autoplug update auto park feature get fuck outa way done
airmo,guessing adapter available handful legacy manufacturer shipping plug happen
somi_teslagirl,silly metric people say give everyone america million dollar sell company put money hand greedy people mismanage sick reading post
VidasL,breaking surprisingly released updated version model china refresh happened model brings update interior exterior even spec tsla
CleverSovereign,wig nog get internet hop worth section home living kid different daddy look phone see top white woman want see today life good
bean_khleb,let use referral credit
Moraea_Asrai,gift mental power come god divine concentrate mind truth become tune great nikola
HullTeslaModel3,heading longer day happy could miserably short day heading
kindsimplebrave,agressive dog want kill dog put muzzle dog either muzzle dog dog allowed public near child proven beyond reasonable doubt safe sound bite
simonsasala1,mwamba upo sawa ila katolik tupo vzr sema tu haya machumia tumbo ndo yanatuharibia alisema want secret universe think energy frequency vibration
OptimusBound,nation largest electric vehicle manufacturer well bout
TeslaHipster,training skill best combo scenario
William243318,etharmy renowned company cryptocurrency fomc stronger doge inevitable nft upcycle arrives ethereum arbdoge ai builder source dune light sui doxcoin
RandallWeb49862,still left right shake n bak six brother nebeatrix say capture issa fake community note right hand drake matrix
Brettharwood,msm report caused another vehicle travelling opposite carriageway wheel fall
XOLimoDriver,ready rail bot saw day fr
Nockit1,break ground craziest supercharger yet diner
kindsimplebrave,professional opinion important dog reactivity different aggression
TeslaPhx,make whiskey deal
SparkyTheTesla,day human rested home today joy ride tomorrow town ready odometre km
vishalmistry40,bringing ambient lighting slowly model sort impact autopilot fsd maybe use show autopilot engaged disengaged useful watching driver interior camera due light inside cabin
kindsimplebrave,unless dog well trained working dog able live
hanyurwiya65334,
Lootster,look fair share marketing china
waku_waku,would employer want work soon bankrupt co
Jeff51815695076,etharmy renowned company cryptocurrency lawmaker provide regulatory clarity decentralized data tool become central doxcoin
kindsimplebrave,vicious dog slaughtered killed without doubt mind true
BigTeslaMoney,responds see respond tsla
unsolicitedx,wow even nicer sheloveselon
kindsimplebrave,puppy trying bite child mistake taught nibbling snapping habit adult dog bite child though dog euthanized sure
kindsimplebrave,loved puppy sasha sasha tried bite child staying home asked family leave rather get rid puppy loved needed puppy literally child
schumi090,german public aware factory germany
SailcatsSW,experience going lot better
shankara_rajan,nov panasonic invested million stock price around two year later stock price risen cent news something always reflect stock price
vimpunk,true yet true outlier need focus u far surpasses anyone else metric think openai big tech etc
stephen_lofy,smelled gasoline filled scary gas station left oil stain driveway left radiator fluid stain driveway double check backing worry another company producing better day excited
mister_irony,girl girl love girl watch tv speak heaven know heaven know heaven know recipe
GopNihilist,complete false flag operation got dumb think
GiantNyk,company saving u auto industry ffs
TeslaGreece,economist normal person
Rubenpopp,supercharger experience
kane2164plays1,im buying get older
ISniffElonsMusk,wait probably includes pedestrian driver wow safest vehicle road
TV10R,much accessory sale mention
veecee00,wonder already developed consciousness
BizTechAcademy1,pump prem friday see share price rise first day quarter prem kod lithium premierafricanminerals aim canmax ftse
ChrisKing_161,fault fur buying junk
kindsimplebrave,honestly though elizabeth showing made life worse
kindsimplebrave,sure really annoying kept showing look alive say sure would realistically codependently attached seeing somebody need saved sorta disturbing savior complex
the000z,driver insufferable
Gigachad11111,gon update design even far future
AndreaR15176763,individual criticizing capitalism sporting apple watch
MatthewCisler,hardest part making sure clean
murrinthesun,make gangster machinery piece art work body similar corvette
JKattla,indeed grander scope endeavor extends beyond mere delivery encompasses pursuit robotaxi optimus must disregard foray insurance venture within realm energy formidable dojo contemplation
ZJS1966,point american buy
TeslaRaijin,thet finished naruto reread catching boruto go back reading ravage sure find last left rot
kindsimplebrave,honestly find elizabeth sorta deplorable person ugly bleached hair bad sense fashion short skirt public always acting impulse heart rather logic showing want yet love
soldbytina,never excited vehicle
MPrathap64159,india
waterknight7,apple music saying
TehranYimby,yeah gotten booster shot drive wish knew ancient rome think bouldering fun really want go japan day
arctanno,imagine haggling bot
William217930,etharmy renowned company cryptocurrency reddit user minted million nft avatar milady meme coin bitget come pfps doxcoin
TeslaHipster,shanghai version better
GimalTesla,love hidden gem airdropvault airdrop
klordafrica,cybertruck masquerade amazing
kindsimplebrave,elizabeth fight disagreement still mother respect would try control elizabeth people thing always elizabeth elon always though
LadyWells42,driving completely solar powered house built river completely surrounded nature
GimalTesla,love hidden gem airdropvault airdrop
AviAgrawaal,
Simoncuocuo,glad union
50_dgk,oooo lucky either brainwashed poor family pretending brainwashed cut
pirate_alia,good god first seen twitter obnoxious sure also others sensible ca string coherent sentence together since busy sucking muskrat anyways followed
valmsmith39a,profound amazingly complex function approximated neural network accurately map permutation photon count matrix frame video acceleration chg vel dir value account traffic light speed limit sign stop sign vehicle cyclist basically everything even go little speed limit good driver particular situation slow keep driving though debris v true obstruction drivable space something occupancy network trouble bc technically debris occupies space cross lane line appropriate situation driving around accident could correct may figured important piece agi puzzle
b_kumbakaran,wait set shop india
pharmazsister,aware bet
Ende__Gelaende,german public aware eine recherche von zeigt die katastrophalen arbeitsbedingungen tesla gigafabrik brandenburg gepaart mit politischem versagen hier ein paar ausschnitte im threat
ISniffElonsMusk,woah hundred thousand people use beta available year died software active incredible self driving software important
quantum_heat,hey white color way highland free option u highland released north america spain white color way free
klordafrica,really cool cybertruck masquerade interesting
navelveriyan_2,trending pic coming soon
alanyapxh,build best ev fsd bot buyer come build best app content creator creator follower come first principle thinking x master plan
naval,best argument x everything app least likely get creator follower
kindsimplebrave,least go cruise unless boat electric environmental consequence cruise ship horrible responsible death world financially support cruise
teslaownersSV,x real news
TeslaDiva99,funny usps operates philippine
Steven1669521,etharmy renowned company cryptocurrency token company nft released feature bitcoin btc plenty room arbitrum optimism nftartwork doxcoin
Steven161801,etharmy renowned company cryptocurrency ethereum sustainability among key factor bnb market deleveraged second doxcoin
busines73618521,unicorn security rblfcb schlagdenstar bscfcsp koevfb bocbmg seenotrettung plattform schlepperei code böhmermann ulreich meinungsfreiheit ngo merz neutralitätspflicht boateng hafen germany götze mastodon hitzetote
seanmcdonaldxyz,want go store win proceed want learn meditation openai win proceed
ArturSimonian,think help armenia word elon certainly would help modern day armenian genocide going nobody talking
TeslaHipster,always stay neutral
TESLA_8787,forgive
TeslaRaijin,deep thought getting bite eat
hassan_sakhta,model rear bumper would ripped right
Ronald874195246,etharmy renowned company cryptocurrency okx venture invested hundred team ethgate eth remain subject ofac regulation polygon doxcoin
TeslaHipster,exactly literally combusts called internal combustion engine
BillyInParis,dan pissed know take miltary contract
ElonMuskLegacy,elonmusk silly metric giant pile cash really stock company instrumental creating technically lose way every stock randomly drop
binaratmaja,elonmusk silly metric giant pile cash really stock company instrumental creating technically lose way every stock randomly drop
TeslaModelDoge,wonder
50_dgk,bit different prototype saw prototype amazing person
khizerii_xviii,factor could impact tsla stock price october overall performance stock market event related event related ev industry overall economic climate risk recession
harishiyani,yeah
B_Buxler,nothing could done lithium battery fire emits via
kindsimplebrave,called police told elizabeth trying break
TeslaForThe_Win,starting pay senior engineer year see stanford harvard yale mit grad asked would work respond attracting best talent world
AnthonyKin1566,lb bike sound right
TeslaGreece,right igor bigger nazi continues tweet everybody laugh lie unfortunately believe lie
autoZillaLeasin,construction theater restaurant begin santa monica
kindsimplebrave,kt talked rather go authority mother
TeslaBoomerPapa,never hear dem leader official denouncing horror msm show clip god save queen claim anti gun violence anything say shame
TeslaModelDoge,sometimes search 𝕏 stuff instead google
tesla_tuga,trash
nathonrose,communication nav help nag integrated wife vw
kindsimplebrave,kt fault
OneScottMinute,also two showroom nm appears inventory online customer could couple week window picking transfer would hesitate reading online past people given hour
m_smalltree,hope supercharger canada
Derek71424807,
kindsimplebrave,elizabeth may strong spirit body fragile yet resilient though broken glass fist hand would cut covered scar probably would unable use well rest life
khizerii_xviii,factor could impact tsla stock price october overall performance stock market event related event related ev industry overall economic climate risk recession
tryliarder,elon playing diablo
cb_doge,got interested technology video game elon
tryliarder,elon playing diablo
GeoffreyHodies,thanks asking hopefully elon would buy
DaveWarnedYou,soon putin decides want bring back fold
FreeAtLastTX1,currently visiting europe entire section parking lot charging station never saw usa
VisionaryVoid,nikola brilliant inventor scientist made many prediction ahead fact vegetarian lifelong vegetarian believed key good health longevity photographic memory incredible memory able memorize entire book image great detail obsessed number many quirk obsession number would often thing set walking around building time entering germaphobe strong aversion germ would often refuse shake hand people also hated pearl human hair invention often ahead many invention fully appreciated lifetime since become essential component modern technology example work alternating current ac laid foundation modern power grid invention coil still used radio technology today
MTGrepp,alarm system home
TeslaUSGov,good luck alex complete fucking fraud block anyone call bullshit
HeavyMetalShip,home security system would fire
P1ezz,nigga porn
happymelon88,hidden news cause need continue flood people every country eth btc xrp acnh axie pet ai pilot bts sox blackpink fortnite trucker biker canuck oiler bruin raptor nba nhl nfl raider maverick leaf oiler nft taxi wing xbox bc
iamyesyouareno,another random cold blooded execution white man philadelphia u medium coverage national outrage supposed
TeslaHipster,saw west temple street earlier today la sure looked similar range rover evoque
BudClearance,elon illegally took south african land many emerald cost
TeslaModelDoge,wish could vote president
kindsimplebrave,elizabeth shown banging door window
klordafrica,laudable great news win
hanyurwiya65334,
TradeNewHorizon,performance major u tech return market capitalization ratio per closing price friday september stockmarkets stockstowatch investing facebook apple amazon microsoft
DaveWarnedYou,maybe elvis alien sorry dude story b
kindsimplebrave,kt done called elizabeth police wait think called police
TradeNewHorizon,performance major u tech weekly return return closing price friday september stockmarkets stockstowatch investing facebook apple amazon microsoftrewards
AncientSeeking,great see developed citizen use km long uninterrupted road long pathway
KTRBRS,introducing india first km long laned mw solar power generating healthway world south korea solar roof top covered great job
JeremiahBonds,lose ton every stock drop
einsla_,einstein cute girl einstein cute girl leave pizza crumb einstein everywhere face
kindsimplebrave,anyways told kt something needle phobia hypodermic needle literally phobia worked hard make
tryliarder,thanks insight
Mullin822775Tim,heard sister brand pas gas made day
TeslaForThe_Win,come massive gigafactories screaming body hit production target people apply every available position
AllthingsLNG,every ev sell well
disclosetv,vw temporarily curb production electric vehicle zwickau dresden due weakening demand
jintana31911550,color favorite much
day_to_Mars,lose stock randomly drop sell care drop
TeslaModelDoge,net worth cash liquid
bajie4ppl,owner
dumbalpha_,ir scramble last week wall street analyst adjust way big miss feed seo
OneScottMinute,buying used model inventory difficult life mexico pick phoenix colorado spring requires flight taking work mention long held make happen
BillyInParis,year major redesign model refresh confirmed highland code name
tesla_pill,everyone body different although wish hyperbolic chamber decide want attend certain task
stevenmackeyman,salary dollar something
Kevin1118479,etharmy renowned company cryptocurrency floki interoperability onboarding innovation last year avalanche infrastructure order attract billion aptos doxcoin
babishaaq,way
Elio05687549,carbon credit profit subsidy
sa_futurist,refreshed model sign upgrade coming hardware upgrade great felt original missed beat fsd beta coming u
Tesla_Asia,continuously seek way improve ownership experience
AzulReal65,party thrown billion taxpayer money throat trillionaire state brandenburg industrial settlement
VisionaryVoid,nikola visionary insight wireless communication groundbreaking experiment invention coil left enduring impact world technology innovation ability foresee potential wireless communication wireless power transmission dating back early century testament remarkable genius although idea ahead fully realized lifetime laid groundwork many wireless technology use today legacy pioneer electrical engineering wireless communication continues inspire scientist engineer innovator push boundary possible world technology
MTGrepp,based think would happen whole completely sold
PepPeplee6,tendency future feat matchbox adventure series model
TravelTeslaDad,sam scan go wait line name brand want buy kirkland milk egg
khizerii_xviii,stock price expected remain volatile october investor continue weigh company growth potential risk posed potential recession challenge tsla elonmusk ev stock trader trade
VisionaryVoid,interesting fact related nikola prediction wireless communication development coil electrical resonant transformer produce electricity work coil various application notable aspect use early wireless transmission experiment believed coil could employed wireless power transmission could potentially provide electricity remote location without need extensive power line made remarkable demonstration wireless power transfer technology fully realized lifetime innovative work wireless power transmission laid foundation later development wireless communication visionary idea continue influence modern technology today
DaveWarnedYou,good mental health lady obese important health period understand get older start need hip knee replacement back chronically hurting diabetes take better care eat bloated take walk every day stop expecting everybody else world change way think accomodate lazy overweight self
kindsimplebrave,tried talk kt illegal forced injection survived murderer rapist attacking lake hodges killed child kid child kt assumed talking needle illegal drug
elonmusk,silly metric giant pile cash really stock company instrumental creating technically lose way every stock randomly drop
tonyapc42,fake boring exist three technical problem solved political problem point anyone care engineering go political economy instead
radshaan,spoiled option graduate engineer today work hard problem autonomous car cruise rivian drone robotics anduril zipline uber aerospace space tech spacex relativity astranis boom hermeus satellite company future computing interface meta reality lab apple microsoft mixed reality lab quantum computing ibm quantum google quantum ai ai obviously nuclear energy helion biotech bcis lot company popular one
VanSwat2021,oh also ruined twitter lost half money removed
TobiMuelhauser,favourite feature model highland
SM22TESLA,china part russia
originalne8094,hahahahaha carry around friggin lb battery har har har
SteadyCompound,valuation always take profitability growth rate growth runway moat consideration still early inning ev amongst thing relative valuation traditional automobile company might underestimating future apart strong head start tech supercharger network etc superior cost structure able maneuver much better competition saddled debt
dit_gamer,space x vr ride action idk
SaunaAl_l_,normalize uber ride
SaunaAl_l_,
kindsimplebrave,angry
TeslaNut7,see trump good job manipulating
kindsimplebrave,feel mad kt called police instead talking asked help
MikeCurtis69,zealand excellent first world country high
